{
  "fixture_version": "1.0.0",
  "envelope_version": "1.0",
  "description": "Recorded Gateway northbound read used for Unity / React consumer parity. One GET /snapshot response at cursor 44, followed by seven incremental stream frames. Exercises: status_online, telemetry in a synchronised (UTC) clock domain, command_ack, status_offline, heartbeat, a stale/degraded observation, a stale-only device, a telemetry observation in an unsynchronised (device-monotonic) clock domain, an exactly duplicated event, an out-of-order event, an explicit gap frame and a liveness heartbeat frame. The Unity C# and the React/TypeScript consumer project this SAME recording to the SAME expected state.",
  "gateway": {
    "service": "Smart Factory IoT Gateway",
    "version": "0.1.0",
    "http_port": 8001,
    "ws_port": 8000
  },
  "snapshot": {
    "envelope_version": "1.0",
    "cursor": {
      "high_watermark": 44,
      "last_sequence": 44,
      "since_sequence": 0
    },
    "high_watermark": 44,
    "snapshot_count": 7,
    "events": [
      {
        "envelope_version": "1.0",
        "event_id": "11111111-2222-4333-8444-555555550038",
        "device_id": "conveyor-a",
        "module_id": "conveyor",
        "event_type": "status_online",
        "sequence": 38,
        "observed_at": 1792832398000,
        "received_at": "2026-10-24T09:00:00.000Z",
        "received_at_ms": 1792832400000,
        "boot_id": "boot-a-7f3c",
        "units": {},
        "quality": {
          "status": "good",
          "reason": "",
          "stale": false,
          "out_of_order": false,
          "clock_domain": "utc",
          "latency_ms": 2000
        },
        "payload": {
          "status": "online",
          "reason": "keepalive"
        },
        "mqtt_topic": "smart-factory/conveyor-a/status",
        "mqtt_timestamp_ms": 1792832398000,
        "ingested_at": "2026-10-24T09:00:00.000Z",
        "timestamp": 1792832398000,
        "stale": false,
        "out_of_order": false,
        "is_timestamp_synchronized": true,
        "latency_ms": 2000
      },
      {
        "envelope_version": "1.0",
        "event_id": "11111111-2222-4333-8444-555555550039",
        "device_id": "conveyor-a",
        "module_id": "conveyor",
        "event_type": "telemetry",
        "sequence": 39,
        "observed_at": 1792832399000,
        "received_at": "2026-10-24T09:00:01.000Z",
        "received_at_ms": 1792832401000,
        "boot_id": "boot-a-7f3c",
        "units": {
          "temperature": "centi_celsius",
          "humidity": "centi_percent",
          "speed": "rpm"
        },
        "quality": {
          "status": "good",
          "reason": "",
          "stale": false,
          "out_of_order": false,
          "clock_domain": "utc",
          "latency_ms": 2000
        },
        "payload": {
          "schema_version": "2.0",
          "source_format": "amlp-structured",
          "device_id": "conveyor-a",
          "timestamp": "2026-10-24T08:59:59.000Z",
          "uptime_ms": 3599000,
          "structured": {
            "state": "RUNNING",
            "speed": 60,
            "sensors": {
              "temperature_centi_c": 2850,
              "humidity_centi_percent": 6500
            }
          },
          "metadata": {
            "gateway_id": "gateway-001",
            "translated_at": "2026-10-24T09:00:01.100Z"
          }
        },
        "mqtt_topic": "smart-factory/conveyor-a/telemetry",
        "mqtt_timestamp_ms": 1792832399000,
        "ingested_at": "2026-10-24T09:00:01.000Z",
        "timestamp": 1792832399000,
        "stale": false,
        "out_of_order": false,
        "is_timestamp_synchronized": true,
        "latency_ms": 2000
      },
      {
        "envelope_version": "1.0",
        "event_id": "11111111-2222-4333-8444-555555550040",
        "device_id": "sorting-1",
        "module_id": "sorting",
        "event_type": "command_ack",
        "sequence": 40,
        "observed_at": 1792832399000,
        "received_at": "2026-10-24T09:00:02.000Z",
        "received_at_ms": 1792832402000,
        "boot_id": "boot-b-2a91",
        "units": {},
        "quality": {
          "status": "good",
          "reason": "",
          "stale": false,
          "out_of_order": false,
          "clock_domain": "utc",
          "latency_ms": 3000
        },
        "payload": {
          "request_id": "102",
          "status": "acknowledged",
          "status_code": 0,
          "sequence": 40,
          "command": "SORTING_START",
          "attempts": 1
        },
        "mqtt_topic": "smart-factory/sorting-1/command/ack",
        "mqtt_timestamp_ms": 1792832399000,
        "ingested_at": "2026-10-24T09:00:02.000Z",
        "timestamp": 1792832399000,
        "stale": false,
        "out_of_order": false,
        "is_timestamp_synchronized": true,
        "latency_ms": 3000
      },
      {
        "envelope_version": "1.0",
        "event_id": "11111111-2222-4333-8444-555555550041",
        "device_id": "sorting-1",
        "module_id": "sorting",
        "event_type": "status_online",
        "sequence": 41,
        "observed_at": 1792832400000,
        "received_at": "2026-10-24T09:00:03.000Z",
        "received_at_ms": 1792832403000,
        "boot_id": "boot-b-2a91",
        "units": {},
        "quality": {
          "status": "good",
          "reason": "",
          "stale": false,
          "out_of_order": false,
          "clock_domain": "utc",
          "latency_ms": 3000
        },
        "payload": {
          "status": "online",
          "reason": "keepalive"
        },
        "mqtt_topic": "smart-factory/sorting-1/status",
        "mqtt_timestamp_ms": 1792832400000,
        "ingested_at": "2026-10-24T09:00:03.000Z",
        "timestamp": 1792832400000,
        "stale": false,
        "out_of_order": false,
        "is_timestamp_synchronized": true,
        "latency_ms": 3000
      },
      {
        "envelope_version": "1.0",
        "event_id": "11111111-2222-4333-8444-555555550042",
        "device_id": "sorting-1",
        "module_id": "sorting",
        "event_type": "telemetry",
        "sequence": 42,
        "observed_at": 1792832401000,
        "received_at": "2026-10-24T09:00:04.000Z",
        "received_at_ms": 1792832404000,
        "boot_id": "boot-b-2a91",
        "units": {
          "temperature": "centi_celsius",
          "speed": "rpm"
        },
        "quality": {
          "status": "good",
          "reason": "",
          "stale": false,
          "out_of_order": false,
          "clock_domain": "utc",
          "latency_ms": 3000
        },
        "payload": {
          "schema_version": "2.0",
          "source_format": "amlp-structured",
          "device_id": "sorting-1",
          "timestamp": "2026-10-24T09:00:01.000Z",
          "uptime_ms": 7199000,
          "structured": {
            "state": "IDLE",
            "speed": 0,
            "sensors": {
              "temperature_centi_c": 2210
            }
          },
          "metadata": {
            "gateway_id": "gateway-001",
            "translated_at": "2026-10-24T09:00:04.100Z"
          }
        },
        "mqtt_topic": "smart-factory/sorting-1/telemetry",
        "mqtt_timestamp_ms": 1792832401000,
        "ingested_at": "2026-10-24T09:00:04.000Z",
        "timestamp": 1792832401000,
        "stale": false,
        "out_of_order": false,
        "is_timestamp_synchronized": true,
        "latency_ms": 3000
      },
      {
        "envelope_version": "1.0",
        "event_id": "11111111-2222-4333-8444-555555550043",
        "device_id": "press-1",
        "module_id": "press",
        "event_type": "telemetry",
        "sequence": 43,
        "observed_at": 1792832401000,
        "received_at": "2026-10-24T09:00:05.000Z",
        "received_at_ms": 1792832405000,
        "boot_id": "boot-c-51d2",
        "units": {
          "temperature": "centi_celsius",
          "speed": "rpm"
        },
        "quality": {
          "status": "good",
          "reason": "",
          "stale": false,
          "out_of_order": false,
          "clock_domain": "utc",
          "latency_ms": 4000
        },
        "payload": {
          "schema_version": "2.0",
          "source_format": "amlp-structured",
          "device_id": "press-1",
          "timestamp": "2026-10-24T09:00:01.000Z",
          "uptime_ms": 903000,
          "structured": {
            "state": "IDLE",
            "speed": 0,
            "sensors": {
              "temperature_centi_c": 1905
            }
          },
          "metadata": {
            "gateway_id": "gateway-001",
            "translated_at": "2026-10-24T09:00:05.100Z"
          }
        },
        "mqtt_topic": "smart-factory/press-1/telemetry",
        "mqtt_timestamp_ms": 1792832401000,
        "ingested_at": "2026-10-24T09:00:05.000Z",
        "timestamp": 1792832401000,
        "stale": false,
        "out_of_order": false,
        "is_timestamp_synchronized": true,
        "latency_ms": 4000
      },
      {
        "envelope_version": "1.0",
        "event_id": "11111111-2222-4333-8444-555555550044",
        "device_id": "weld-1",
        "module_id": "weld",
        "event_type": "telemetry",
        "sequence": 44,
        "observed_at": 1792832370000,
        "received_at": "2026-10-24T09:00:06.000Z",
        "received_at_ms": 1792832406000,
        "boot_id": "boot-d-77e1",
        "units": {
          "temperature": "centi_celsius",
          "speed": "rpm"
        },
        "quality": {
          "status": "degraded",
          "reason": "stale",
          "stale": true,
          "out_of_order": false,
          "clock_domain": "utc",
          "latency_ms": 36000
        },
        "payload": {
          "schema_version": "2.0",
          "source_format": "amlp-structured",
          "device_id": "weld-1",
          "timestamp": "2026-10-24T08:59:30.000Z",
          "uptime_ms": 899000,
          "structured": {
            "state": "IDLE",